query_id,name,description,tags,query_engine,query_sql,is_private,is_archived,owner,g1_actual,g2_actual,g3_actual,g4_actual,g5_actual,g1,g2,g3,g4,g5
2156112,NFT Artist Collector Leaderboard with ENS (Parameterized),"Rank collectors of all NFTs deployed by a given artist wallet by unique artworks owned, with first mint date, ETH paid, and ENS name",[],v2 Dune SQL,"WITH contracts AS (SELECT DISTINCT address FROM ethereum.traces WHERE type='create' AND to IS NULL AND from={{Wallet}} AND block_time BETWEEN CAST('{{From Date}}' AS TIMESTAMP) AND CAST('{{To Date}}' AS TIMESTAMP) AND success=TRUE), artworks AS (SELECT hash, nft_id, ELEMENT_AT(ARRAY_AGG(user),0+1) AS user, MIN(datetime) AS datetime FROM (SELECT evt_tx_hash AS hash, id AS nft_id, to AS user, evt_block_time AS datetime from erc1155_ethereum.evt_TransferSingle WHERE contract_address IN (SELECT address FROM contracts) UNION ALL SELECT evt_tx_hash, tokenId, to, evt_block_time FROM erc721_ethereum.evt_Transfer WHERE contract_address IN (SELECT address FROM contracts)) GROUP BY hash,nft_id), fans AS (SELECT user, COUNT(nft_id) AS unique_artworks_own, MIN(datetime) AS datetime FROM artworks GROUP BY user) SELECT fans.unique_artworks_own, DATE_FORMAT(CAST(fans.datetime AS TIMESTAMP),'%d %b %Y') AS first_mint, fans.user AS wallet_address, SUM(t.value/1e18) AS price, ens.name AS ENS FROM fans LEFT JOIN ethereum.transactions t ON t.hash IN (SELECT hash FROM artworks) AND t.from=fans.user LEFT JOIN labels.ens ON fans.user=ens.address GROUP BY fans.unique_artworks_own,fans.datetime,fans.user,ens.name ORDER BY unique_artworks_own DESC",False,False,_nikhil_,nft,nft_minting_systems,nft_collector_leaderboard_with_ens_and_price,unique_artworks_own|first_mint|wallet_address|price|ens,leaderboard,infra,blockchain_data,nft_artist_collector_leaderboard_ens_parameterized_scalar,unique_artworks_own|first_mint|wallet_address|price|ens,scalar
2156118,CryptoPunks Weekly Trading Volume (Bid-Adjusted ETH),Weekly CryptoPunks sales volume in ETH with lateral join to resolve zero-value sales using last accepted bid,[],v2 Dune SQL,"select date_trunc('week', evt_block_time) as week, sum(CASE WHEN a.value=0 THEN COALESCE(b.value,0) ELSE a.value END)/1e18 as transaction_volume_eth from cryptopunks.CryptoPunksMarket_evt_PunkBought a left join lateral (select value from cryptopunks.CryptoPunksMarket_evt_PunkBidEntered where punkIndex=a.punkIndex and evt_block_time<=a.evt_block_time order by evt_block_time desc limit 1) b ON TRUE where a.value<20000*1e18 group by 1",False,False,az134949,nft,nft_marketplaces,nft_collection_weekly_volume_timeseries,week|transaction_volume_eth,time_series,nft,nft_marketplaces,weekly_trading_volume_bid_adjusted_eth_leaderboard,week|transaction_volume_eth,leaderboard
2156133,NFT Cross-Platform Sales Volume Leaderboard (All Exchanges),"Rank NFT collections by USD volume across all platforms with sales count, floor, median, high, owners, items and sell fee percentage",[],v2 Dune SQL,"SELECT ROW_NUMBER() OVER (ORDER BY SUM(price_usd) DESC) AS Rank, COALESCE(collection_opensea_dune, nft_contract_address::text) AS collection, COUNT(*) AS sales, SUM(price_usd) AS usd_volume, SUM(price) AS total_volume, ROUND(MIN(price::numeric),5) AS lowest_sale, percentile_cont(.5) within GROUP (ORDER BY price) AS median, MAX(price) AS high_sale, COALESCE(art_blocks_owners.owners,s.owners) AS owners, COALESCE(art_blocks_owners.items,s.items) AS items, fee/10000 AS sell_fee_pct FROM dune_user_generated.cryptuschrist_allexchange3 a LEFT JOIN dune_user_generated.cryptuschrist_nft_projects5 on nft_contract=a.nft_contract_address LEFT JOIN dune_user_generated.cryptus_holders s ON a.nft_contract_address=s.contract_address WHERE price_usd IS NOT NULL AND price>0.005 GROUP BY collection,owners,items,sell_fee_pct,a.nft_contract_address ORDER BY 4 DESC",False,False,andrealittle137,nft,nft_marketplaces,nft_cross_platform_sales_volume_leaderboard,rank|collection|sales|usd_volume|total_volume|median|owners|sell_fee_pct,leaderboard,analytics,blockchain_data,nft_cross_platform_sales_volume_leaderboard_exchanges_leaderboard,rank|collection|sales|usd_volume|total_volume|lowest_sale|median|high_sale|owners|items|sell_fee_pct,leaderboard
2156139,Uniswap V3 Ethereum Weekly Pool Creation Count,Number of new pools deployed on Uniswap V3 Ethereum per week since genesis,[],v2 Dune SQL,"select block_date, count(pool) as pool_count from (select date_trunc('week', evt_block_time) as block_date, evt_tx_hash, pool from uniswap_v3_ethereum.Factory_evt_PoolCreated) group by 1 order by 1",False,False,xiegudong45,defi,dex_amm,pool_creation_weekly_timeseries,block_date|pool_count,time_series,defi,dex_clmm,weekly_pool_creation_count_timeseries,block_date|pool_count,time_series
2156125,Uniswap V3 Ethereum Pool Fee Tier Distribution,"Share of Uniswap V3 Ethereum pools by fee tier expressed as percentage labels (0.01%, 0.05%, 0.3%, 1%)",[],v2 Spark SQL,"select concat((fee/1e4)::string,'%') as fee_tier, count(*) as pool_count from uniswap_v3_ethereum.Factory_evt_PoolCreated group by 1",False,False,shaw0524,defi,dex_amm,pool_fee_tier_distribution_breakdown,fee_tier|pool_count,breakdown,defi,dex_clmm,pool_fee_tier_breakdown_scalar,fee_tier|pool_count,scalar
2156147,FORT Token Holders with Balance > 1M,Count unique addresses holding more than 1 million FORT tokens (Forta Network security token),[],v1 Ethereum [deprecated],"WITH transfers AS (SELECT evt_tx_hash, trns.from AS address, -trns.value AS amount, contract_address FROM erc20.ERC20_evt_Transfer AS trns WHERE contract_address='0x41545f8b9472d758bb669ed8eaeeecd7a9c4ec29' UNION ALL SELECT evt_tx_hash, trns.to AS address, trns.value AS amount, contract_address FROM erc20.ERC20_evt_Transfer AS trns WHERE contract_address='0x41545f8b9472d758bb669ed8eaeeecd7a9c4ec29'), transferAmounts AS (SELECT address, SUM(amount)/1e18 AS poolholdings FROM transfers GROUP BY 1) SELECT COUNT(DISTINCT address) AS holders FROM transferAmounts WHERE poolholdings>1000000",False,False,5krin5hatz,defi,token_contracts,token_holder_count_above_threshold_scalar,holders,scalar,payments,token_contracts,token_holders_balance_scalar,holders,scalar
2156127,CVX Token Latest Hourly Spot Price,Most recent hourly average price for Convex Finance (CVX) token from prices.usd in last 6 hours,[],v2 Dune SQL,"WITH price AS (SELECT DATE_TRUNC('hour',minute) AS time, AVG(price) AS price FROM prices.usd WHERE contract_address='0x4e3FBD56CD56c3e72c1403e103b45Db9da5B9D2B' AND minute>DATE_TRUNC('day',NOW())-interval '6h' GROUP BY 1 ORDER BY 1 DESC LIMIT 1) SELECT * FROM price",False,False,hookb,defi,oracle_feeds,token_spot_price_latest_scalar,time|price,scalar,analytics,price_feeds,token_latest_hourly_spot_price_leaderboard,leaderboard,leaderboard
